{
  "schemaVersion": "1.0.0",
  "startTimeUtc": "2026-10-20T21:00:00Z",
  "offsetSeconds": [0, 1, 2, 3],
  "distanceMeters": [0, 2.8, 5.6, 8.4],
  "heartRateBpm": [120, 122, null, 125],
  "speedMps": [2.8, 2.8, 2.8, 2.8],
  "cadence": [168, 170, 170, 172],
  "cadenceUnit": "STEPS_PER_MIN",
  "altitudeMeters": [25.2, 25.4, 25.4, 25.6]
}
